{
  "$schema": "./schema/capsize-1.json",
  "schema_version": 1,
  "standards": "1.x",
  "name": "spikeforge-hub",
  "type": "library",
  "languages": ["python"],
  "framework": null,
  "databases": [],
  "runtimes": {"python": ">=3.10"},
  "entrypoints": {
    "python": "spikeforge_hub",
    "cli": "spikeforge_hub/cli.py"
  },
  "task_runner": "just",
  "commands": {
    "setup": "setup",
    "build": "build",
    "test": "test",
    "lint": "lint",
    "format": "format",
    "typecheck": null,
    "run": "run",
    "clean": null,
    "docs": "docs",
    "ci": "ci"
  },
  "dependencies": {
    "python": "pyproject.toml",
    "core": "pyproject.toml"
  },
  "instructions": {
    "canonical": "AGENTS.md",
    "rules": ["capsize/base", "capsize/native"]
  },
  "owner": "Capsize-Games",
  "license": "BSD-3-Clause"
}
